{
  "$schema": "https://json-schema.org/draft/2020-12/schema",
  "$id": "https://github.com/heimgewebe/vibe-lab/schemas/experiment.registration.v1.schema.json",
  "title": "Vibe-Lab Experiment Registration v1",
  "type": "object",
  "additionalProperties": false,
  "required": [
    "schema_version",
    "experiment_id",
    "consumer",
    "decision_target",
    "measurement",
    "expires_at",
    "closure",
    "boundary"
  ],
  "properties": {
    "schema_version": {"const": "experiment.registration.v1"},
    "experiment_id": {"type": "string", "pattern": "^[0-9]{4}-[0-9]{2}-[0-9]{2}_[a-z0-9][a-z0-9-]*$"},
    "consumer": {
      "type": "object",
      "additionalProperties": false,
      "required": ["organ", "use"],
      "properties": {
        "organ": {"type": "string", "minLength": 1},
        "use": {"type": "string", "minLength": 10}
      }
    },
    "decision_target": {
      "type": "object",
      "additionalProperties": false,
      "required": ["question", "owner"],
      "properties": {
        "question": {"type": "string", "minLength": 10},
        "owner": {"type": "string", "minLength": 1}
      }
    },
    "measurement": {
      "type": "object",
      "additionalProperties": false,
      "required": ["metric", "method", "success", "falsification"],
      "properties": {
        "metric": {"type": "string", "minLength": 1},
        "method": {"type": "string", "minLength": 10},
        "success": {"type": "string", "minLength": 5},
        "falsification": {"type": "string", "minLength": 5}
      }
    },
    "expires_at": {"type": "string", "format": "date-time"},
    "closure": {
      "type": "object",
      "additionalProperties": false,
      "required": ["review_at", "allowed_outcomes", "archive_path"],
      "properties": {
        "review_at": {"type": "string", "format": "date-time"},
        "allowed_outcomes": {
          "type": "array",
          "minItems": 3,
          "uniqueItems": true,
          "items": {"enum": ["promote", "reject", "archive"]},
          "contains": {"const": "archive"}
        },
        "archive_path": {"type": "string", "pattern": "^experiments/_archive/[^/]+$"}
      }
    },
    "boundary": {
      "type": "object",
      "additionalProperties": false,
      "required": ["experiment_only", "no_auto_policy", "no_auto_routing", "no_queue_authority", "no_runtime_authority"],
      "properties": {
        "experiment_only": {"const": true},
        "no_auto_policy": {"const": true},
        "no_auto_routing": {"const": true},
        "no_queue_authority": {"const": true},
        "no_runtime_authority": {"const": true}
      }
    }
  }
}
